{
  "package_schema": "piphi.package.v1",
  "id": "piphi-camera-stream",
  "name": "Piphi Camera Stream",
  "version": "0.1.2",
  "roles": [
    "integration_runtime"
  ],
  "deployment": {
    "mode": "container"
  },
  "legacy_projection": {
    "type": "integration",
    "deployment_mode": "standalone"
  }
}
